,news_title,comment_url
0,延期に揺れる晴海フラッグ　売り主は補償も説明会も拒否,https://headlines.yahoo.co.jp/cm/main?d=20210130-00000018-asahi-soci
1,米補佐官、中国への強い対応示唆　日豪印と協力「対価払わせる」,https://headlines.yahoo.co.jp/cm/main?d=20210130-00000019-kyodonews-int
2,荷物に消毒液、ドアにはアラーム…特派員が体験した中国の“厳戒”水際対策 「日本よりも安全に感じる」の声も,https://headlines.yahoo.co.jp/cm/main?d=20210130-00010001-abema-cn
3,"<selenium.webdriver.remote.webelement.WebElement (session=""b0ad88c51f9fb0bf6967d5177df36238"", element=""be361317-3cd8-42d5-ae13-790694bb2579"")>",This news page have no comment.
4,"<selenium.webdriver.remote.webelement.WebElement (session=""b0ad88c51f9fb0bf6967d5177df36238"", element=""c286ad40-97fa-4bef-8159-edf35772a6cc"")>",This news page have no comment.
5,日本発売確定！ 中国超高級車「紅旗・H9」 輸入元に直撃取材！ 噂の真相とは,https://headlines.yahoo.co.jp/cm/main?d=20210130-00340958-kurumans-bus_all
6,ダルビッシュ有が考える“投げ過ぎ問題”「古いことが変わるのは、僕たちの世代が指導者になってから」,https://headlines.yahoo.co.jp/cm/main?d=20210130-00010000-realspo-base
7,前田敦子＆勝地涼が離婚協議中　所属事務所「プライベートは本人に任せております」　１８年７月結婚,https://headlines.yahoo.co.jp/cm/main?d=20210130-01300043-sph-ent
