,number,日付,ユーザー名,コメント
1,1-1,3時間前,I ♡ Japan,"二日続けての過去最多…
今週が心配です…"
2,1-2,3時間前,通りすがり,オリンピックは厳しいだろうね
3,1-3,3時間前,his*****,月曜日では過去最多の３９２人…。本当に多い。残念ながらこれからも更新してしまいそう。感染者はもちろんだけど死者や重症者も本当に減って欲しいです。
4,1-4,3時間前,min*****,"今週は出だしから記録更新…
週末が怖いな。
しかもクリスマスか。"
5,1-5,3時間前,小人たち、19人。,"「392人は月曜日としては、過去最多」
↑日々の検査数は全く違うのに、この文言。
これによりメディアが数字でしか判断していないことが、証明された。"
6,1-6,3時間前,pok*****,"だから、重症者が減ったってのは
死んだのか回復したのかどっちなのよ？"
7,1-7,3時間前,mk*****,"今週、罹患するとかなりリスク高くなります。年末年始にまたがるからです。
休診してるクリニックやERへのアクセスもかなりし辛くなるからです。
例年でも、ERはかなり混雑してますが、今年は簡単には受診出来なくなくなると予想されるからです。せめて今週だけは真の勝負の一週間です。"
8,1-8,3時間前,mas*****,"すでに菅政権の入国緩和政策によって外国人7万人が入国。GoTo停止だけでなく“5人以上の会食やめよ”などと叫ぶのに一向に海外から流入するウイルスには批判もしない。航空各社はマスコミにとって優良スポンサー。彼らの「海外便正常化要請」は分るが、露骨過ぎないか。今度は“スポンサー守って国滅ぶ”。

だから減らないのよ。 入国緩和しているうちは抑え込みなんて到底無理よ。春節シーズンはどうなるんだろうか。恐怖でしかない。 日本が大切なら即刻入国制限してほしい。昨日だって海外から成田、羽田など4空港に到着した男女25人 コロナに感染 発表してるし。

イギリスでは変異したウイルスも発表されてる。入国緩和を再び厳しくしてほしい。"
9,1-9,3時間前,tststs,"日テレもTBSも
「月曜最多」という言葉で報じていたが、
800人超えを経験してもなお、
392人で「最多」という言葉を使いたいかね？
「月曜最多」って、意味ある？"
10,1-10,3時間前,cod*****,"年末はコロナじゃなくても医療機関が休みになる時期なので、体調管理はしっかりしなければいけない
救急車来ても受入できない病院が多くなるのは目に見えてるので、せめて年明けまでは普段より気を付けるべき"
11,2-1,3時間前,,水曜日か木曜日あたりに都内1000人越えでクリスマスから年明けまでの緊急事態宣言になりそう。。
12,2-2,3時間前,日本を守ろう,"週末の人出とか見れば当然の結果だよね。
クリスマス関連のイベントとかモニュメントが圧倒的に多いのは東京。
池の鯉にエサを撒いてるのと同じなんだから仕方ない。
イベントやモニュメントの主催者は一体何を考えているのか、寧ろ
そっちの方を聞きたいと思う。

政府が悪い、判断が遅すぎるとは言っても、最終的には個々が如何に
我慢して自制できるかに掛かってる。
ただ最近は、我慢できない大人が増えている気がしてならない。"
13,2-3,3時間前,iba*****,"日曜日に続いて、月曜日の最多更新と数字の底上げが続いている。
Go Toトラベル停止して、大阪・北海道がやや減り気味なのに、東京は増加中。
東京をとにかく収束させないと全国の数字も減らない。
打つ手はもうそんなに残っていない。"
14,2-4,3時間前,ma*****,"これで7日連続で曜日では過去最多。特になにもしなければ減るはずなのに、減らないですね。

毎日の陽性判定者数の発表は警告にもなるし、気が引き締まって行動抑制にもなるし、ある意味感染拡大防止策になっていいのではないかと思う。
政府がなにもしないのだから尚更。"
15,2-5,3時間前,(๑´ڡ`๑),もう、ある程度の年齢から、延命治療をしないでいいと思う。
16,2-6,3時間前,aoy*****,外国人の入国に関してより厳格に規制できないものか。潜伏期間中に入国することだってある。入国者数をみると無防備ではないかと思う。
17,2-7,3時間前,yuk*****,月曜では最多かな。今週も金曜前後に過去最多を更新、1000人/日も有り得るかも。
18,2-8,3時間前,kgr*****,"コロナ変異種、国内未確認　加藤官房長官は未確認と言っているが
そんな事、絶対にないと言えるのか？
政府は一度、外国人の入国制限を発動した方がいい。
イギリスでは、RNA型の特長の突然変異もおこり、
感染力もジョンソン首相も強いと会見している。
欧州もイギリスとの渡航制限を導入する傾向です。

症状がなければ、いまはすぐに入国できるのか。詳細は
解らないですが、即入国すれば、その後いきなり、外国株の
ウイルスが日本に流入して大変な事になる。

検査して症状がなくても、2週間の隔離がされていない様であれば
入国制限を入国制限をかけるべきです。
初めは中国人の入国禁止措置を遅れてとったが、欧州・アメリカ
といった国の入国制限は取らなかったため、日本のウイルスも
変異してしまった経過がある。有事の際の時は臨機応変な政策の
決定をしてほしいものです。政府の決断力の遅さには本当に実感します。"
19,2-9,3時間前,aao*****,"400人台だとイメージ悪いから
392人にするという
魂胆が見え見え。"
20,2-10,3時間前,xyz*****,"日本政府もあきらめ感が漂っているなぁ。
後は、解散して責任のなすりあい。
日本も終わりだ。
新種のコロナに飲みつくされる。
加藤官房長官本当にのんきなもんだ。
手だてを考えないとひどいことになる。
年末の企業休業とワクチン頼み。その前に何か策はないのか？"
21,3-1,3時間前,jub*****,イギリスで変種株が見つかり感染力がより強いらしい。安倍政権が初動に失敗して社会も経済も止まりましたよね。経済重視の菅総理にはぜひ早めの対策を期待したい。大変なことになりますよ。
22,3-2,3時間前,yao*****,"出たぁー、「月曜日では最多」
まるで映画の興行収入と表現が同じッ。
初日で歴代最高額とか３日間で最高額などなんでもいいから最多最高を探し出すッ。"
23,3-3,3時間前,e3m*****,コロナの予防して感染したら、それが神の言葉だと思って諦めようよ
24,3-4,2時間前,buv*****,ちょっと前の木曜、金曜の数字ですよね。これって。
25,3-5,2時間前,tan*****,"東京の12月のコロナ死者数は72人
これで緊急事態宣言だしたら自殺者は何人出るだろうか

ちなみに東京の11月の死者数はコロナ→34人、自殺→198人"
26,3-6,2時間前,kad*****,"昨日日曜日池袋に行きましたが、めちゃくちゃ人いっぱい、
人も麻痺で、慣れた
感染拡大止まらない、当たり前"
27,3-7,2時間前,igu*****,"変に慣れてきて行動を全く抑制しようともしてない・・・スポーツでも駅伝もサッカーも普通に観戦者がいてるし。春にはこれら一連のでも全て警戒して、開催しても無観客必須だったのが一体どうしたことかと。
テレビ番組でも普通に観光地や繁華街での飲食店の推奨などが流されていては、それらをあおっているようなもの。なんでそんなのを普通に放送していられるのでしょうか？。
そして挙句の果てには政治家の宴会だらけの問題も含め、こんな感染拡大に貢献する要素が盛りだくさんでは減少などありえないし、今後少し警戒を強めて少々減少したら、またまるでウイルスの減少を阻止するためにあらゆるキャンペーンを復活・・・。オリンピックどころかこれでは何年も付き合わされて逆に経済に大変な傷を与え続けることになってしまいます。"
28,3-8,2時間前,fsh*****,"日本には世界一の医療インフラがある。
しかし医療提供体制に多くの問題があり欧米の僅か10分の1以下のコロナ患者の発生で医療が逼迫する。
このままコロナ患者が増え続ければ間違いなく医療が崩壊するだろう。
加藤正則氏の著書「医療40兆円の無駄」を読めば分かる。

いまやるべきこと。
１）コロナ患者、重症患者、救急患者の医療を担う病院の診療報酬を倍増させること。
そうすればコロナ患者の受け入れ病床も増やせる。看護師も集められる。
２）コロナ患者や重症患者、救急患者のうち集中治療を行うべき患者のトリアージの方法を決めておく。老衰状態の高齢者は集中治療の対象外とすることを全国民のコンセンサスとする。

以上を速やかに行うべき。
医療崩壊してからでは遅い。"
29,3-9,2時間前,lze*****,"朝日新聞の相変わらず印象操作に都合の良い数字のみ列挙する煽り湾曲記事。

新型コロナは「最多、最多」で経済を破壊、希望を破壊、80年あまり朝日新聞の構造は変わっていない。

いまこそ国民は数字にあたって、データを正しく読んで、ファクトから正確に事態を把握して、朝日新聞に扇動されないようにしないと、益々世の中が
滅茶苦茶になる。

朝日新聞の悪意しかない煽り湾曲報道に、洗脳された輩が騒ぎ、緊急事態宣言再発令という事態になったら、今度こそ日本経済は破綻して、朝日新聞の思惑通り、日本国は崩壊する。"
30,3-10,2時間前,cal*****,東京の場合「何曜日では過去最多」という報道が多いのは他県と集計システムが違うせいかな。確かに「過去最多」には違いないわけで、「偏向報道」とか「煽り」とか言うのはどうかな。客観的事実に目を背けても仕方ないと思うけどね。ともかく外出時にはしっかりマスクを付けましょう。鼻出し、とか「顎マスク」はだめですよ。
31,4-1,2時間前,tin*****,"先週の月曜より検査数は4000件減ってますね。
水曜以降はまた過去最多。
毎日会見するなら抽象的なお願いばかりしてないで、いい加減国基準重症者数とか実際の病床使用率、豊洲クラスターの状況とか厳しい現状発信してからお願いしないと。"
32,4-2,2時間前,can*****,"感染者の数字で議論が進んでいるみたいだけど、本当に重要視するのは重症者数ではないのか？
だとすれば、今日の重症者数は第三パピークよりも15人も減っており、感染が抑えられつつある、と言えるだろう。"
33,4-3,2時間前,mine,"月曜日の過去最多を更新し、新規陽性者数の7日間移動平均は615.4人と増え続いている。
昨日現在の入院・療養者数は6,078人と6,000人を超え、入院者数2,107人の実質的な病床使用率は9割超と医療提供体制の逼迫は危機状況にある。
入院・療養等調整中の1,327人もの新規陽性者が入院か宿泊療養、自宅療養の決定待ちで自宅待機になっている。
様々な問題点が指摘される自宅療養は1,502人にのぼるのに対し、宿泊療養ホテルへ入所する宿泊療養者は939人で稼働は5割に満たない。
調整を司る保健所機能も逼迫しているのは明らかで、昨日判明した広島での悲劇的な「事件」は他人事ではなくなる。"
34,4-4,2時間前,ピエロ,"重症患者が３人減ったのは、
回復したのか？亡くなったのか？

どちらですか？"
35,4-5,2時間前,kmf*****,"無為無策で感染野放し。世論のダメだしでＧＯＴＯは一時停止したが医療は崩壊状態のまま。
緊急事態宣言を出さないなら、ＰＣＲ検査を大幅に拡充し、無症状者を含む感染者の検出と隔離しかない。

菅のコロナ対策は経済対策しかない。菅は、(竹槍の)３密回避とマスクと手洗いの自助を強いるだけ。
今からでも公助の検査体制と医療体制の整備を実施し、最低でも検査と発熱外来の難民をなくせ。

特に日本は検査数が圧倒的に少ない。
日本は検査能力７.５万件／日、アメリカ１２０万件／日、中国４８４万件／日。
人口あたりの実施件数は世界で１５１位、最貧国レベル。

バイデンは「全国民に、無料で、定期的に」と、検査体制の一段の拡充を進める。

中国は、桁違いのＰＣＲ検査で感染の封じ込めに成功し経済も順調に回復している。青島は１０月に９４０万人を、北京は６月に１千万人を検査した。

一方、台湾の累積死者数はわずか７人だ。"
36,4-6,2時間前,むむむ,だから毎日何百人も陽性者増えてるけど、重症者とか変わってないでしょ。。もう、みんなは何を恐れているの？？
37,4-7,2時間前,kur*****,"何か起こってから対策では遅すぎる
警察と同じならいらんのよ"
38,4-8,2時間前,tos*****,"感染者という学者の決めた係数しだいでどうにでも変動する数字に踊らされている人が多いですが見るべきは死者重症者数であってこの時期としては別に多くないです。
しかし自粛に起因する自殺者は爆増しているので本当に恐ろしい殺人ウイルスは自粛やロックダウンを政府に訴える人々のことだと言えるでしょう。"
39,4-9,2時間前,cn******,濃厚接触者じゃないと言うだけで保健所から門前払いにされる人が多いのにこの数とは
40,4-10,2時間前,ike*****,住みづらい街になってきたなぁ。年末は一斉に首都圏脱出やな。地方が大変だ。
41,5-1,2時間前,shi*****,"とにかく、いかに、重篤化の患者を出さないか、ですが、基礎疾患の問題はありますよね。
なんの病気なのでしょうか。
糖尿病の方が多いですよね。
私の家族にも、基礎疾患を持っている人がいますが、以前から、食べ過ぎの二型糖尿病、タバコの吸い過ぎの肺癌　と、どうなんでしょうね。
こういう人は、何度、注意されても、直さない、やめないから、病気になったんですよね。
それで、今回も、手洗いはして、でもしないから。忘年会はダメだよ、と何度、注意されても、やるんですよ。　だから、生活習慣病にもなるし、コロナにもなりますよね。
まー、注意を聞き入れる事が出来ない精神の病気と言われれば、それまでですが。
友人に、医療従事者もいますし、夫婦でレストランを経営している方もいます。
もう、これ以上のコロナ拡大も困りますし、これ以上、経済が壊滅的、再生不可能な状態になる事も困りますよ。"
42,5-2,2時間前,∗∗∗∗∗,"変異種国内未確認、だが、明日はわからない、という緊張感ある一言がほしい。

医療関係者、これだけ叫んでるのに、国政はのろのろ。
崩壊の危機にあるなかで、国会議員は治療後回し！とか宣言したら、意識変わりそう。"
43,5-3,2時間前,tgmv****,"早く海外からの入国を止めないと、
『コロナの変異種を国内で確認しました』では遅いんですが
何回同じミスヲ繰り返すんですかね？
頼りない集団ですわ。。"
44,5-4,2時間前,**,"あれ？
ちょっと少なめ？
頭打ちの傾向？

やっぱりGoToだったんだな"
45,5-5,2時間前,pon*****,"4月の緊急事態宣言で感染のピークを遅らせつつ次のピークまでに医療体制の強化をするという方針だった。
なのに半年間、政府は医療強化政策を全くやらず、全てを医療現場任せにしてしまった。
支援のない医療現場は疲弊するばかりで、いまや各地で医療崩壊寸前といわれている。
まったくもって、政府の人災だと思います。"
46,5-6,2時間前,俺の彼女が北欧出身です。留学生やで。,"菅政権のこれまで
11/20頃〜日本医師会、東京都医師会、分科会の尾身会長など専門家がGoToの一時中断を再三訴えるも、無視し続ける
12/3 GoToを来年6月まで延長する方針を固める
12/4 野党の質問が苦手だから国会はさっさと閉会
12/4 やっと初めての総理記者会見を開くも、原稿を棒読み、コロナの件には殆ど触れず、記者の質問には聞き飽きたフレーズを壊れたレコードのように繰り返す
12/11 みなさんこんにちは、ガースーです、GoTo停止は考えていません
12/12 世論調査で内閣支持率40%に急落
12/14 支持率低下に焦ってやっとGoToの全国一斉停止を発表、しかし停止期間は12/28〜、事業者には旅行代金の50％を税金で補償
12/14 高齢者8人で銀座の高級ステーキ店で忘年会を楽しむ
12/16 会食をではなく国民に誤解を招いたことを反省
以上、完全に人災だと思う。"
47,5-7,2時間前,dyn*****,見出し命
48,5-8,2時間前,モーリス,"今週木曜日が怖いな
重い方の人数は増えてないように見えるが、そうでないのだろう"
49,5-9,2時間前,hun*****,近いうちに1日1000人以上を記録しそうですね
50,5-10,2時間前,str*****,"来年こそは楽しく明るい年にする為に今は我慢時じゃないかな？
オリンピック開催やGW、夏には祭りや花火大会、キャンプやBBQに海、プール！
みんなで予防を徹底的にし不要な外出や3蜜を避ければ不可能ではないハズ、そーすれば医療への負担も減るしコロナも終息すれば去年までの普通の日常がおくれる。
そんな当たり前で普通の平和な日々をみんなで取り戻しましょーよ！！"
51,6-1,2時間前,mih*****,"だいぶん減ってきましたねえ　泣
でも、もうすぐクリスマスとお正月です。みんな外出して経済を活性化させましょう！
そうすればまた、感染は"
52,6-2,2時間前,nis*****,"コロナで始まりコロナで終わった2020年でしたね。
皮肉なことにこのコロナは日本社会の、もっと言うと日本の政治の問題点を浮き彫りにしたように思う。
政治に頼る時代はもう終わりましたね。"
53,6-3,2時間前,nam*****,"時期が時期だし人出てるし…
仕方ないでは片付けてられないけど、仕方ない…"
54,6-4,2時間前,mac*****,"当然の結果だなという印象です。
毎日重症者数の増減を見る度、重症者の方が回復したから「前日から3人減った」なのか、お亡くなりになったのか、どっちかなと思ってしまいます。"
55,6-5,2時間前,pea*****,ガースーが8人で会食したせいもあるが、入国制限して下さい。
56,6-6,2時間前,aki*****,"人間の心理からいってこの感染者数をみて減ってると気が緩んだりしてしまうのかなぁと、、、

むしろ知りたい国民は、感染者数は厚労省ホームページで閲覧しないと把握できないようメディア規制して緊張感高めて様子見てみるとかはいかがでしょう？"
57,6-7,2時間前,gnr*****,"死者数は公表できないのかね？
重症者が減ってると言っても回復して減ったのか、それとも亡くなって減ったのかで全然違うと思うのだが。"
58,6-8,2時間前,nik*****,"こういう状況にも関わらず、あれこれ己に都合の良い理由を見つけて、観光地、繁華街、行楽地に出かけている老若男女。

この人達全員、コロナに罹患して欲しい。

正直者が損してはならない。"
59,6-9,2時間前,chy*****,格安PCR陽性者から回ってきたから増えてるのか知りたい。
60,6-10,2時間前,man*****,"とうとう月曜日のマジックですら感染増を抑えきれなくなってきたな
ちなみに今でも検査絞りまくり。職場の人間が陽性になった程度ではPCR検査拒否されます"
61,7-1,2時間前,寿司喰いねぇ♪,"日曜日も仕事のため仕方無く都心に通ってるけど、まあ賑やか。コロナなんて遠い世界の話だね。池袋のマックなんて店の外まで客の行列出来てたよ。
この国政府だけじゃなくて国民もダメだ。"
62,7-2,2時間前,cho*****,"日本の検疫は緩い。隔離も一切してないのに、ビジネス客どんどん日本に入国してる。しかも感染者もいるのにこの辺一切報道してない。

「視聴率取れないから」だって。ばかかっつーの。"
63,7-3,2時間前,yus*****,"政府はどのような対策を行うのか。
楽しみですね。"
64,7-4,2時間前,ab,今週の陽性数がどうなるか。政策を推し進めた自民党幹部への忖度で全面中止に踏み切れず、ぬるぬる一時停止や延期という形を取るつもりなのでしょうが、GOTO規制だけでなく、欧州型コロナ変異種が猛威を奮っているので、早急に入国制限措置を取って欲しいですね。
65,7-5,2時間前,ttt*****,"ジャンジャン経済回せ〜!!

貧困ほど辛いものはないから!!"
66,7-6,2時間前,tun*****,"重傷者が減ったというのは…
症状が軽快へ向かったということ？
残念ながら亡くなったもいうこと？
そこが知りたいです。"
67,7-7,2時間前,coccoc,"毎週繰り広げられる、月曜だから劇。

そろそろ重症者とかそういう数字に置き換えて発表してほしい"
68,7-8,2時間前,mon*****,どこでもマスクせずに喋り続ける外人の流入を止めねば。できればみなお引き取り願いたい。まずは日本人の命を守ることよ
69,7-9,2時間前,aka*****,"いつも思うのですが、PCR検査を受けた人の人数に対して、何人が感染してるって出さないのかなー？
検査数があがれば感染者もふえるわけだし、今日は何人でしたー、増えたねー減ったねーで一喜一憂してるのはどーかな？"
70,7-10,2時間前,rad*****,朝日ほんとにえげつない。煽りたい、国民を恐怖に陥れたい会社。ホントにこんなところの新聞を取ったらいけない。過去一番にはならないので、月曜日では最高というあくどい表現。おいおい、そんなこと言っていたら、いつまでたっても過去最高を連発出来てしまう。本当にこんな会社のニュースを見たらいけないと思う。
71,8-1,2時間前,gd3*****,早く指定感染症外してくれよ。
72,8-2,2時間前,azg*****,3人減ったのはお亡くなりになったからではないですか？ちゃんと仕事しよーね。
73,8-3,2時間前,k*****,"複数人での会食が感染源になってそう。
喋るだけじゃなくて飛沫のかかったであろう物を食べるから感染率は上がるよね。
GOTOイートはテイクアウトのみに適用すれば良いのにと思ってました。"
74,8-4,1時間前,n18*****,僕は月曜日によく下痢になります。
75,8-5,1時間前,gt.*******,"月曜日は毎週300で高止まりだったが1.3倍に
単純計算今週合計5000人いきそう
18日にGoTo中止したが効果がでるのは3週間後"
76,8-6,1時間前,kon*****,"月曜、過去最多！終わったな！
間違いなく東京も医療崩壊まっしぐら、広島であったような自宅待機やホテル待機での死者が出ない事を祈る

正に、神のみぞ知る！"
77,8-7,1時間前,kon,"減ってるな！オッケーオッケー！
遊びに行くか！"
78,8-8,1時間前,sek*****,"コロナ変異種で更なる感染を防ぐ為にも
海外からの入国制限をした方がいい
未確認って呑気な事を言って無いで
早急に対策して頂きたい"
79,8-9,1時間前,********,スガに二階にオリンピックに国民は殺される！
80,8-10,1時間前,ダメだこりゃ,"高止まりではなく増加中。
加藤、西村の緊張感のない面は見たくない。
ましてや菅の腐った魚の目はもっとだ"
81,9-1,1時間前,,"いつも思うのですが、重症者が減った理由を書いて欲しいです。
回復して減ったのなら朗報なのですが……。"
82,9-2,1時間前,t_s*****,出た～過去最多
83,9-3,1時間前,月蜻蛉,重症者が死んだから減ったというのはアリなの??
