,number,日付,ユーザー名,コメント
721,73-1,59分前,mbe*****,"こんな状況下でも読売新聞は箱根駅伝を強行しようとしている。
ステイホームだから史上最高視聴率を期待だと。
火事場泥棒と変わらない。この国はどこまで腐る？"
722,73-2,58分前,jet*****,"小池都知事も、会見で感染対策を講じようと努力するのは分かるが、東京都だけそれをしても、首都圏がバラバラ対応なので、抜け穴が生じて、結局は、大晦日を周辺の県に人が流れて、そこが逆に大幅に混雑状態となるので、やはり首都圏一体で、同じぐらいの規制にしないと意味がないと思う。

特に、神奈川県の鎌倉市なんかは、東京からも比較的に近く、時短要請の対象外となっている地区なので、当然、大晦日には飲食店は終夜営業する訳で、多くの人が終夜運行を中止時間帯をさければ、行ける状態だし、参拝後は、食事や由比ガ浜に行って初日の出を見るのが定番となっている上、タクシーを使えば江の島もすぐに行けてしまうのです。"
723,73-3,58分前,aba*****,"東京　都心部は異常だ　気持ち悪いぐらい人が
往来してる　絶対行きたくない所だね！
感染者が増えていくのは　誰が考えても
当たり前でしょ...無駄な会議などやめて
ロックするべきだ！人の往来を止めなければ
意味がない！注意を促している意味がわからない？
コロナな減ると、思ってやってるんだね...
可愛いそうだ　絶望感に苛まれています。"
724,73-4,58分前,loot through,感染者増えても重症者減ったのは朗報。
725,73-5,58分前,truth,過去最多って言いたいだけ
726,73-6,58分前,dai*****,先日「3人減った」言って3人亡くなってて嫌な気分した。死者の有無言って欲しい。
727,73-7,58分前,wrf*****,日本はオリンピック開催国なのにこんな手ぬるい対策だけでいいんでしょうか？東京都を始め感染拡大地域にマスク着用義務化の条例を出してマスクしてない人達とマウスシールドしているお店それを主導しているテレビ局を厳しく規制したほうが良いと思います。もうGoToトラベルを中止したり後ろ向きな事ばかりやってないで前向きにマスク着用義務化でもバシッと決めたらどうなんですか。
728,73-8,58分前,har*****,"一度感染してしまえば後は楽と考えてる人も多いと思う。果たしてそれは間違いか。
誰も間違いだとはっきり言わない状況では、これからも増え続けると思う。"
729,73-9,58分前,adj*****,"マスメディアも大変だな
間違ったことやってもスポンサーなら何も言えなくなるしニュースも大胆に出来ないしな"
730,73-10,58分前,aiai*****,"東京の街頭インタビューで若者がコロナなんか関係ない、もう我慢できない、という趣旨の回答をしているのを見て愕然とした。
言いたいことは分かるよ。我慢してきたよね。
でも、、、、、何だか悲しくなりました。"
731,74-1,58分前,ram*****,"アホ政府は、「政府の迅速な対策により新規感染者を392人に“抑え込めた”」

とか言いそうで怖い。"
732,74-2,58分前,kar*****,"月曜日で392・・・減ったねー！
誰も気にしてないけどね。
もうマスコミは変異コロナの話題に夢中さ！"
733,74-3,57分前,tak*****,焼きだせ。
734,74-4,57分前,himajin,"週末の人出が多いのは、各地でイルミネーションのイベント等が行われてることもあるけれど

GOTOでクリスマスや年末年始は旅先や近場のホテルで過ごそうとしていたのに中止した人々が家で過ごすために慌てて準備してるっていうのもあると思う

毎年海外旅行している人も日本国内で久しぶりに過ごすお正月
普段はお買い物しないのに仕方なくうろうろしてそう"
735,74-5,57分前,nis*****,"感染は減らないだろう、幾ら要請しても東京都は人口が多い、
年末に出て歩く人は大勢いる、1月20日過ぎくらいには最多更新の日々が続く事だろう。
本気なら要請だけじゃなく補償金（小出し）を思い切って出すしかないだろう。
国も対策にしろ補償金も小出しでは駄目だろう。
支持率あげるのであれば国民に金をだせば収まる。"
736,74-6,57分前,mor*****,"春節を思い出せ、あれでコロナが蔓延した。
入国規制緩和するな。"
737,74-7,57分前,z29*****,"子供じゃ！ないんだから

各自が一人一人

ちゃんと制限して行動すべき

ＧＯＴＯトラベル！のせいにするのは

おかしいよ！"
738,74-8,57分前,pur*****,"感染しても無症状や軽症の人もいるし、格安で検査が受けられる体制も整ってきて感染数だけは伸びてる状況ですよね？
感染増えた減ったと騒ぐのでなく
死者数、重症者数、医療の圧迫具合が重要なのではないですか？"
739,74-9,57分前,mu*****,"今年の1月まで、自殺者を努力不足だの自業自得だの勝手にいけだの言いたい放題罵っていた人たちが、自殺者ガーと叫ぶ不思議。
宗教にでも目覚めたか？"
740,74-10,56分前,※※※,"我が家は年末年始に身内７人くらいで集まるのも、躊躇して日付をずらしたり、時間をずらしたりする予定でいます。７０歳以上が2人いるから。
なのに、会社の関東出身者は帰ろうとする。
こっちにいても暇だし、、、とかいう。
警戒心が無さすぎる！！"
741,75-1,56分前,tom*****,よもや国が犯した人災。経済止めて早く終わらせてくれ！止めた分の経済は後から必ず戻る。このままダラダラしてる方が経済に与える損害影響が大きいと思う。
742,75-2,56分前,kan*****,"昨日の夜仕事で木更津から小田原方面を走ったいたんだが大渋滞で湾岸線乗ったら異常なまでに空いていた。
ほとんどの人は東京から出かけてるのか？と思うほどだった。"
743,75-3,56分前,toh*****,"死者や重症者を出さない事が重要と言ってましたよね。
感染者が増えれば、死者や重症者が増えるのが当たり前ですよ。"
744,75-4,56分前,wbs*****,"私の周りには、この数でも
「一時の800人とかじゃない
から感染者が減ってきた」
なんていう人がいたり、
平気で頻繁に外食したり、
旅行してる人もいます。

いろいろな報道がありますが
それらをよく理解してきちんと
対処できず、自分さえよければ
という考え方で行動する人が
多くて、先が思いやられます。"
745,75-5,56分前,tsu*****,あくまでお願いだからね。菅が守らないななら国民も守らないお願いは聞き飽きた
746,75-6,56分前,mas*****,減ってきましたねー
747,75-7,56分前,sxu*****,本当ヤフコメを見て思うのは1億総評論家ですね。皆さんがいくらコメントしても何の意味もないですよ。大切なのはこの無能なアホ内閣を退陣に追い込むべく怒りを政府に叩きつけることです。
748,75-8,55分前,rtu*****,同感です、国を動かす人に生き道理を感じます、そもそも菅さんは立場をどう思っているのかわかりません、国内外に見放されば日本国は、、、
749,75-9,55分前,won*****,"『武漢コロナはただの風邪、皆が感染すれば免疫獲得して恐れる必要がない！』

「マスク要らないただの風邪、経済回すことを優先すべき、経済停滞から自死が増える派」の皆さんが提唱していた主訴である。

ウイルスについてある程度知識があれば、集団免疫などＲＮＡ遺伝子のウイルスには意味がないことに気付く。

飲食の商売を含むいわゆる水商売を営む者にすれば対策は死活問題と言いたいだろうが、ウイルスを駆逐できなければ結果は同じであり、ウイズコロナなど妄想でしかない。

最悪のシナリオは強化型武漢コロナ・アグレッシブが蔓延すること。既製のワクチンの効果が見込めない恐ろしいウイルス。人に感染することを繰り返すことで錬成される。

日本、東京。後手後手の対応のツケは誰が払う？死にゆく国民とその家族に負担させて、投資家や経営者は自分の利益を守る？それらに政府は忖度する？

主権在民。訂正が必要では？"
750,75-10,55分前,sho*****,ゴートゥーはせなあかんで
751,76-1,55分前,plp*****,"海外からの渡航もっと厳しくしないと。行くのも入るのも。流行り出した頃中国からの渡航禁止すべきだったし、３月もあれだけヨーロッパ騒いでいて、普通に海外旅行行ってる人いてビックリした。
時短要請も応じてない店もあるなら効果は？時短にお金出すんじゃなくて感染対策に出して、守らない店も客も罰金にした方がいいんじゃない？
50センチくらいしか間空いてなかったり、混んでたりする店沢山。アクリル板必須、1.5メートルは離して人数、時間制限とかすればいい。マスクしないで大声出してたら店側が拒否出来たらいい。"
752,76-2,55分前,hi_*****,"イギリスの変異コロナが国内に入って来ないよう、後手後手でない対応を、政府にはお願いします。
さっさと意思決定して下さい。
2月の春節が止められなかったテイタラクを繰り返したら国民の怒りはとんでもないことになる事を自覚してください。"
753,76-3,55分前,通常生活,"過去にあったスペイン風邪から何を学んだ？
この国の議員たちは、他国と違い対応の遅さが目立ちます。
強制法律作るわけでもなく、、、
経済対策も利権がらみとか、、、
保身より、国民の為に、、、、働いてください。"
754,76-4,54分前,fds***,"「単なる風邪」「インフルと似た様なもん」
こういう意見をよく見かけます。
アメリカでの話ですが、ここ数年で最悪と言われたシーズンが2017〜18年で、死者は6万人以上。
私も新型コロナ初期の頃は断定は出来ないもののインフルエンザよりマシな気がすると感じてました。
ですが、現在アメリカにおける新型コロナの死者は31万人以上で、インフルの死者の5倍にも膨れ上がってます。
新型コロナはインフルよりも感染力が強いとの事なので感染者が多い事もあるでしょうけど、結果として5倍もの人達が亡くなってるという事実は見過ごす事は出来ないと思います。
日本国内の死者はアメリカと比べたら極端に少ないですが、イギリス、イタリア、南アフリカ等では変異種が発見されてますし、日本国内でも既に欧米型から変異した東京型が蔓延してるので今後も変異すると考えるのが妥当、となると感染者を減らしておく事は必要なんだと思います。"
755,76-5,54分前,oga*****,"そろそろ国民も気づいているはず。
経済とコロナ対策は両立できない。
国や自治体は全員を救えない。救う気もない。
結局は自分で防衛して、行政に頼らいで生き抜くすべを身に着けるしかない"
756,76-6,54分前,kei*****,"政府は早く緊急事態宣言出さないと……
でも出して遅いけど。
ますます支持率下がりますね。"
757,76-7,54分前,hid*****,最大の原因を言わずGO Toのせいにしている。これは侵略である。
758,76-8,54分前,c_s*****,「重傷者63人で医療崩壊っておかしい！」　と気付く人少なすぎない？
759,76-9,54分前,sna*****,そりゃこんな極右都知事と自民党政権選ぶ国だよ市民も同類に決まってんじゃん
760,76-10,54分前,wqh*****,"過去最高とか月曜日の感染者過去最高とか、何かにつけて最高自慢をして、ただ不安を煽るだけの報道何とかして欲しい！
国に対して危機感を持つように煽れよ!!"
761,77-1,54分前,sss*****,"海外ではロックダウンしてるところもあれば外出禁止令もでてる国もある。
日本はどうよ？5人以上の会食控えてね！旅行代負担するのやめるね！

単なるお願いなのに、この文句ばかりの国民。笑

こんな国民ばかりだから中国や韓国に舐められるんだよ。笑

政府批判する日本国民は、どこぞのアホな隣国が日本にしてるトンチンカンなことを自ら政府にしてること忘れるなよ。笑

普通に考えれば、感染者広がってるのに、外出禁止令出さないでくれてありがとうだろ。笑

ほんと井の中の蛙ばかり。
平和ボケしすぎ。"
762,77-2,53分前,bocppm,商業新聞の新聞としてのマスコミの役目は終焉、崩壊しています。マスコミ内の中核は自認しているはずです。口ごもり、焦点をずらす。ワクチンの薬害の調査や警告。変異したコロナの国内流入問題、発表記事以外の社会の木鐸としての機能が麻痺しているマスコミは自民党の宣伝機関そのものです。「ガースー」と同じ土俵にいることを自覚してください。
763,77-3,53分前,m*******,入出国制限しないと大変な事になると思う。菅さん、このまま行くと年末までに支持率30％切るで。自民党も20％切ると思うな。
764,77-4,53分前,jfp*****,日本は自民だ菅だ小池だ吉村だとか国民が愛するのは右翼ばかりで病が一向に癒える事はありませんがアメリカはトランプが駄目だと判れば４年で国民が考えを改め切り替える事が出来た、日本は国を衰退させ続ける自民党政権は変わらない上に東京は極右が都知事に再選、大阪でも右翼が引き続き知事を務める始末。日本人って何故こうも真面な国に生まれ変わろうとしないのか謎ですね
765,77-5,53分前,lem*****,"GoToなんか完全中止。再開はなし。税金ばらまいて借金して馬鹿みたい。
とっと宣言出して減少させなければとんでもないことになる。外国では変異している。早く規制しないと日本でも広がる。"
766,77-6,53分前,ifn*****,"新規感染者が出なくなるまで
ロックダウンしろよ"
767,77-7,52分前,sts*****,"何の対策もせず静観している政府。
自分らは会合、会食をし優雅に生活をしている。
１日の感染者が数万人になり、再度緊急事態宣言をし国民に30万くらい給付する事を願うよ。
呑気にワクチンを待ってるいるのか、自然と感染者数が減るのを待っているのか知らんが、あんたらが無駄に使ってる税金が国民に行く事を願う。"
768,77-8,52分前,boy*****,3人減ったのが回復して減ったのか、亡くなられて減ったのかが分かるように報道してほしいです。
769,77-9,52分前,kat*****,"何人仲間入りして何人亡くなって重症者数が減ったのでしょう？
自粛しない奴は、重症者が減って良かったとか思うよ。そもそも医療逼迫など信じていないでしょう。"
770,77-10,52分前,wes*****,また最多かい！
771,78-1,52分前,mm,週末の人だかりが夏より増えてるし変異したウイルスも発見されたしちょっとそろそろ日本が危ない！自分はできないけどそういうトップになったんだったら頑張って欲しい！
772,78-2,52分前,jkk*****,イベルメクチン!
773,78-3,52分前,iat*****,あらゆる最多を繰り出すメディア。
774,78-4,52分前,vif*****,"今更慌ててどうするのか…
もう個人、個人の考えではないかな…
遊びたい人は遊べば良いし、感染したくなければ、大人しくする。
私は、寂しいけれど、外出する事は、誘われても我慢しています"
775,78-5,51分前,toppingtopping,ヨーロッパで流行の強感染型株が東京に入ってきたらどうなるのかな？
776,78-6,51分前,ykj*****,"いつもいつも呼びかけばかり。
都知事も具体的な政策を会見で話せば。

またレインボーブリッジを赤くするんですか?"
777,78-7,51分前,ken*****,"出歩くな…は無理。
ただ、医療崩壊は目前orすでに始まっている。

極力一人or少人数で動く。
飛沫を飛ばさないようにする。
手洗い、消毒等をする。

基本的なことを各自でやるしかないでしょ。
政府が～って文句言ったところで、良くも悪くも変わらない。
まあ、政府は政府ですべきことがたくさんあろうが、我が身は自分で守るしかない。
感染したって病院も助けてくれない(助けられない)かもしれないんだから。"
778,78-8,51分前,wmm*****,"goto停止しろ→減らない
入国制限しろ→減らない
じゃあ緊急事態宣言しろ

ってなるんですよ、世論は必ずなります。
不安だもの。

だけど緊急事態宣言でも初めての冬だから減少するかは分からない。

だったら尾身さんが増加傾向を捉えた時に
2週間緊急事態宣言をしていた方が、
よほど経済に与えるダメージは少なかったと思うし、
国民の支持も得られたと思います。"
779,78-9,51分前,ttt*****,"オリンピックしたいから、300人超える重症者を国の基準を変えて60位に表示する東京。
オリンピックは無理だろ。
再来年でも無理かも。"
780,78-10,51分前,kin*****,"最近は曜日別を利用して「最多（記事）」をキープしていますね。
意地でも「最多」を探してタイトルにしないとイケナイみたいな…頑張ってますよね。次は何で皆んなを煽るのでしょう、楽しみです！
( *´꒳`*)"
781,79-1,51分前,yuk*****,"コロナを2類から5類感染症に引き下げるべき。
無症状者率が30％～50％。
感染させる人は2割以下。
とにかく報道が過剰に国民の恐怖を煽っている。"
782,79-2,51分前,zke*****,水曜日、木曜日、1000超えかな。さあ、どうなるでしょう。
783,79-3,50分前,wct*****,"能無し菅政権。
日本人を見殺し。"
784,79-4,50分前,電極スパーク,海外からの往来を止めないのは何故なのか？海外客から新型コロナの感染者も出てると言うのに止めずにGOTOが悪いだの国内の事しか見てないんだから困るよな。
785,79-5,50分前,js7*****,"GoToと騒いでいるが
東京都知事にも問題があるような気がする
野党と同じに政府任せで、何も具体案を出さない
政府与党だけで乗り切れる状況では無い"
786,79-6,50分前,IT系の風来坊,"週末の人出から見たら意外と少ない。
もっといるかと思った。"
787,79-7,50分前,pip*****,"もう止まらないでしょう。本腰入れて、覚悟決めてやる人がいなければ止まらないです。
国民はそういう人に信頼してついていくんですよ。今は、諦めてます。"
788,79-8,49分前,真島の兄さん,"うちの放デイの管理者が、馴染みのとこへ飲みに行きよった。
県外客を断ってるといえど、呆れてものも言えん…"
789,79-9,49分前,spr*****,"先週は800人を超えて1000人も秒読みかと思いましたが、
今日は300人台ということで収まってきましたね。
良かったよかった。"
790,79-10,49分前,oo,"あんたが緊急会見しても、心に響かない。

国とグダグダ言っている間に感染が拡大した結果責任をどう取る。"
791,80-1,49分前,tea*****,それでも重症者は春より少ないんだよねー
792,80-2,49分前,にこい,もうええっちゅうねん。コロナ。早くワクチン投与開始してほし〜。
793,80-3,48分前,mak*****,たまに前日に飲み会で、次の日に発熱なんてコメントやツイートを見るけど、そんなこと有るのか？
794,80-4,48分前,oki*****,三人減ったって…亡くなったということ？
795,80-5,48分前,tsu*****,減ったなぁ。コロナ、沈静化。
796,80-6,48分前,rkg*****,"菅も小池もオリンピック事業には仲良く幾らでも金撒き散らすが
決断力と判断力が急がれれるコロナ対策はノンビリしてんだもの
馬鹿にするのもいい加減にして欲しいわ"
797,80-7,48分前,wan*****,"ははーん
こりゃ、今週1000人超えるな"
798,80-8,48分前,ช,"東京都で感染者数が何人とか
もうそんなローカルニュースで一喜一憂しないよ。"
799,80-9,48分前,kmh*****,ウイルスが変異してワクチンが無効になる心配が。ばらまかれた可能性も否定出来ない。最悪のケースもイメージしておく必要があるだろう。
800,80-10,47分前,euj*****,"とりあえず、マスクは義務化して。
今はマスク注意した方が加害者ですし。"
801,81-1,47分前,eib*****,"今日テレビで若者が、コロナ関係ないからと言ってました。この一部若者特有のどうでもいいみたいなのどうにかならないのでしょうか…。
若者だけじゃない年配のどこから来るのか分からない余裕みたいなのも理解に苦しむ。"
802,81-2,47分前,skt*****,"若い人はコロナ気にしないんだろうね？気にしないで外出するんだろうなぁ。コロナになってならでは遅いんじゃない？
医療関係者の大変さみたら、お世話になりたくないよ。"
803,81-3,46分前,yuz*****,"人手が多い所でマスコミが帰省しますか？
年末年始はどうしますか？とインタビューして
ニュースに流す。そのインタビューしている人に何故出掛けて居るのですか？不要不急でないのですか？そんな質問はしないの？
それを観ながら自粛しましょうなんて言う
コメンテーター、そんなの緩むの当たり前だ思う。"
804,81-4,46分前,tad*****,"政府は医師会の提言を聞け！

菅、西村、加藤の三馬鹿トリオに日本を任せておけない！"
805,81-5,46分前,vcm*****,都知事が心を一つにして乗り越えましょう！！やって！笑　先菅に言え！笑
806,81-6,46分前,fum*****,中国在住です。春節が恐怖とおっしゃっておりますが、日本の状況の方が圧倒的にひどい状況ですので、行き来でトータル28日の隔離をしてまで日本に旅行に行こうと考えている中国人はおりません。ご心配なく
807,81-7,46分前,wjd,ガースーと愉快な仲間たちの嘘つきどもが全く何も出来ない。口ばかり達者な能無し集団のせいで、日本は感染者は増加するばかり。
808,81-8,46分前,mag*****,"ほいほい
風邪引き検査ニュースお疲れ様でゴンス。
何人死んだかだけ、教えてください。
風邪引きが何人とか、そりゃ自己責任なんでね。
アッシには風邪ひき何人とか言われても、意味わかりませんのでね。"
809,81-9,45分前,gam*****,今後の議員報酬全て医療、飲食業界、その他の業界に当ててもらいましょう！gotoで人を死なせてるんですから、何の報酬もいらないでしょう？？むしろ、もっと支払いなさい
810,81-10,45分前,ゴメス,"まじめにやってないだろ政府
利権と面子は後回しだろうすらハゲが"
811,82-1,45分前,han*****,過去最多詐欺
812,82-2,45分前,mit*****,"勝負の３週間とは何だったのか？感染は増える一方だ。
Gotoトラベルはまだしも、イートが感染を広げたね。経済を取るかコロナを取るかだ。
一体誰と何を勝負したのだ？"
813,82-3,45分前,aev*****,政府や自治体、専門家が強く言ったところで他人事にしてしまう方々が若者中心に大勢いる。欲望に負けて街に繰り出す人が証拠！仕事は仕方がない。
814,82-4,45分前,ne_*****,あーあ
815,82-5,45分前,yas*****,富裕層の都市離れが進んでるらしいね。
816,82-6,45分前,eyeson,減った
817,82-7,45分前,現代に生まれた才谷梅太郎,海外の客は受け入れ拒否しようと思ってる
818,82-8,45分前,yuu*****,"ずいぶん減ったね！
相変わらず政府はノーガード戦法なのに！"
819,82-9,44分前,ygd*****,"少なくなったじゃん
良かった良かった"
820,82-10,44分前,miu*****,都知事の会見見たけど外出の自粛じゃなくて東京都は外出禁止だろ！総理は高級ステーキで忘年会！国民を馬鹿にするな！！今すぐに辞任しろ！政権を連立の公明党にわたせ！自民党はもうダメ！
