,number,日付,ユーザー名,コメント
548,55-8,1時間前,jun*****,"感染者数なんてどうでもええやん、いつまでやんのこの無駄なショー
高齢者が勝手に引きこもってればいい話
現役世代に自粛強要することがおかしい

こうやって日本は高齢者に破壊されていくんだね"
549,55-9,1時間前,3c****,"東京はどうにもならないね。
広がる一方ですね。
いい加減にしてほしい。
他府県に持ち出すことはしないで下さい。"
550,55-10,1時間前,ryo*****,"どうせまた欧州の感染力の増した変異型の流入も許すんだろうこの政府は。
島国という感染対策において恵まれた環境の我が国で、それを活かすことなく、安安と流入を許すんだろうなあ。全く学ばない、愚かしい自民党政府のやることだ。目に見えている。"
551,56-1,1時間前,senkouhanabi,田舎で東京のニュース映像を見ていると・・渋谷、原宿等々あちこちで異常です。普段から人混みに慣れているんだろうけど・・異常です。しかも、インタビューを受けた人も人出が多いと認識をしている。分かっちゃいるけどヤメラレナイんですかね～。政府が無能なのを批判していても感染者は減少しません。要もないのに出歩くな！これしかない。
552,56-2,1時間前,ニャロメ,発熱したからとコロナとは限らないが、休診の多い年末年始に風邪をひきたくないなぁ〜。不安な気持ちで新年を迎えたくないよ。もう年内はじっとしとこ。
553,56-3,1時間前,hfk*****,いちいち大袈裟な表現使うメディア。、月曜で最高？毎日こんな表現ばかりでいい加減うんざりしてくる。馬鹿な記者が多いのかな。
554,56-4,1時間前,sun*****,"若者の街へのお出かけが増えているとニュースで観たけど、政府の言っていることが矛盾だらけだから、若者は自分が感染しないと分からないんだろうな。

国民が悪いわけではない。政府が悪いと実感してます。
特にガースー。。。"
555,56-5,1時間前,nor*****,"いい加減月曜日の陽性者数だすの
やめてほしいわ。
減ってないのに減ったと勘違いする
アホが絶対おるから。
陽性率だせよ"
556,56-6,1時間前,by5*****,"おっ！減ってきた！クリスマス楽しみ！
て人まだたくさんいるんだろうな。"
557,56-7,1時間前,>。<,今後は変異型の流行にも気を配る必要があるのでは？
558,56-8,1時間前,saz*****,普通の病気は、診察してくれるのか不安になる。
559,56-9,1時間前,sug*****,３９２人という数字で感染落ち着いたのかって勘違いしました。月曜日では過去最多なんですね。なんか千人近い数字に慣れている自分がいる。
560,56-10,1時間前,jjl*****,"重傷者数かなり減ってない…
以前のように陽性者数と比例しなくなってきてる"
561,57-1,1時間前,ito*****,"早くやり方が間違っていたと謝ったほうがいい。
一番の愚策は逐次投入。
これで被害が増える。第二次大戦での教訓。
今のままでは、４次、５次と次の波が来る。

若者にとってはただの風邪なのに、無意味な対応をして傷を広げている。

挙げ句の果てに、精神論を持ち抱いたり、兵隊(医療関係者)さんありがとうという始末。
第二次世界大戦と同じだ。戦う武器が竹槍(マスク)とはお笑い種。

進歩してないね。何回騙さらたら懲りるの。

そしてワクチンは新種になり効きそうにない。
つまり決定打にならないことを示している。
唯一の対策が集団免疫による対策なのだが一部の専門家の声を聞かない。

若者にとってはただの風邪なのでコロナを蔓延させ集団免疫を獲得っする。
老人は外出禁止で介護者や介護者の徹底的なpcr検査でコロナは収束する。"
562,57-2,1時間前,crf*****,"数言うのも大事なんだろうが、何故東京は増えるのが突き止める報道や番組作るのもマスコミの役目では？
ただ不安煽るだけでは意味がない。"
563,57-3,1時間前,ころがし涼太,"言うても聞かない人は歩き回る！感染して、医療機関に迷惑かける。
全国民に来年11日まで、家でおとなしくしてて、感染しなかった人には10万円出して、一月末まで、おとなしく家で自粛して、感染しなかった人には30万出すようにしたら、感染して偽った人には100万の罰金と、懲役、それくらいしないと、感染収まらないだろぅ！"
564,57-4,1時間前,aa6*****,"小池都知事が自粛に疲れてる場合じゃありません。と申し上げてますが？
自粛に疲れた訳ではありません。
貴方達、国会議員や知事に信用が無く、疲れてるのです。
言葉に説得力が全くありません。"
565,57-5,1時間前,pos*****,ふるさと納税の期限が近づいてきました。まだの方はお早めに！
566,57-6,1時間前,uvw*****,"もう東京はダメでしょう

東京閉鎖して下さい"
567,57-7,1時間前,(^0_0^)もんもん☆彡,感染した人に会う機会がないんだけど
568,57-8,1時間前,mt2*****,"菅内閣に期待しないほうがよいな(笑)
パフォーマンスだけで人の動きは止まらない！
国が他人事だから国民も聞かない(笑)"
569,57-9,1時間前,asu*****,"マスクは免疫力下げると言われてる。春からずーっとマスク着用してる人は免疫力下がってるんじゃないか。だから冬になり、ウイルスが活性化すると、即座に感染するんじゃないのか。ひ弱になった子どもがすぐに骨折するようなものではないか。自然って甘くないんだよ。

参考までだが、長時間のマスク着用は免疫力下げる、医者が言ってる。ググれば出てくる。マスク愛用者には不都合な真実だろうな。"
570,57-10,1時間前,her*****,"これが昨日より多いのか少ないのか判断が付きにくい。
総数だけの比較では正確に分からない。"
571,58-1,1時間前,mas*****,お、これで7日連続。全曜日で過去最多ですな。緊急事態宣言出しましょ。
572,58-2,1時間前,ああ,減りましたね
573,58-3,1時間前,so7*****,"オリンピック開催の為に入国ユルユルな日本。

変異ウィルスなどお構いなし。

来年の東京は、武漢を超える災厄の都市に変貌するだろう。"
574,58-4,1時間前,yas*****,"東京都はいつまでこのような異常事態が続くのでしょうか？
若者を中心に危機感無さ過ぎます。"
575,58-5,1時間前,hnq*****,もうええねん東京都民!これだけ拡大してるのに先週より今週の方が出掛ける人増えてるやん!ほんま都民のせきにんのなさ自己中心的。同じ日本人として恥ずかしい。情けない。一言言いたい。あほんだら!
576,58-6,1時間前,hid*****,"もう、いいわ
動ける高齢者は金を落として、景気を回して下さい
病院と高齢者施設も自由に！"
577,58-7,1時間前,Ranger,自分とこも後輩が感染したよ。会社上層がどれだけ出張しません！在宅勤務をします！忘年会しません！って言っても旅行やイベントで感染してきて上司が頭抱えてて可哀想。有給とって行くから上司は何も言えないようだ…
578,58-8,1時間前,ofi*****,来年5月までのワクチン接種まで一体どれだけの死者と感染者がでるのか、それを思うと明日は我が身か日々恐怖です。全く対応しない政府は危機感があるのか甚だ疑問
579,58-9,1時間前,umi*****,"コロナの感染は、交通事故と似ている気がします。
もらい事故もあるけど、基本ルールを守らないと事故の危険度が上がる。
まさにルールを守れるか、守れないか。"
580,58-10,1時間前,hir*****,"何とかして最多！と言いたいのね。
流行らせたいの？全然面白くないよ。"
581,59-1,1時間前,yf4*****,"都内は人の移動が止まってないから、当たり前といえば当たり前。

もっと強制的な対策でなければ、感染が治まることはないでしょ？

夜はお店が休みなら行かないけど、昼間の会社はやってるから行かなきゃ行けないしね。
多くのテレワークできる会社も出社させてるしね。"
582,59-2,1時間前,ycd*****,"今どうなっているのか、毎日国は放送すればいい。
国営放送が活躍するのは今が見せ所だ。

なぎゃ、いらない。

会見はきちんと誠意でやってほしいね。
出来上がったQ&Aの原稿読みを聞かされてもつかれるだけでさ。"
583,59-3,1時間前,ass*****,"コイケが年末年始はウチでヒッキーだって。
そんなんムリだよ、みんなウロウロしとる。マスクしてないのも結構いるし。
高級ステーキ屋さがしてウロウロしてんのかもよ"
584,59-4,1時間前,hhp*****,"これは政府が悪いのではなく、遊び惚けて感染する人間が悪い。

勘違いするなよ。"
585,59-5,1時間前,ロケット発射,今月は仕事以外は遠出しない方がよさそうだ。
586,59-6,1時間前,tom*****,コロナさんには、ルル三錠飲ませましょう。
587,59-7,1時間前,kwaitzrt,"まあみんな遊んでますよね
首相が
会食しましょうって
医者の言うこと無視やって
やったからな。
だからしょーがない
って話でもないが。
結果どっかでひっかける。"
588,59-8,1時間前,sm4*****,"看護師とか医者に税制優遇の特別給与が与えられる制度が必要だと思うし、
目先のお金以外にもコロナ発生以降の任務に就いた期間に応じて自衛隊のように年金優遇処置が必要ではないたろうか？"
589,59-9,1時間前,tk_*****,"煽ってるね〜マスコミは。
感染症予防は手洗い、うがい、テレビを見ない。これしかない!"
590,59-10,1時間前,ezo*****,"この時期に外を出歩いている人は、感染してもいと思ってるんだろな。今感染すると、正月休みに発病してしまう。
その時期は病院も休みでまともな治療は受けられないよ。"
591,60-1,1時間前,若者の声代表・高齢化対処委員会,"半分近く減りましたね！
よかったよかった！！"
592,60-2,1時間前,ino*****,もう少ししたら、昨年と比較して、ってワードがつかえる様になるね。
593,60-3,1時間前,shi*****,ヤフコメではもう人数とかどうでもよくなって、政府批判で埋め尽くされてる。
594,60-4,1時間前,bla*****,最多とか、いちいち煽る必要があるのかね？
595,60-5,1時間前,1,"二類指定感染症解除ですかね？
早くして欲しいですね。"
596,60-6,1時間前,aom*****,"とにかく大好きな「過去最多」を使いたいマスゴミ！
毎日、曜日別、週単位、何としても最多にしたいマスゴミ。コロナより怖いよ。"
597,60-7,1時間前,win*****,重症者が減ったのは、快方したのかそれとも亡くなったのか。。
598,60-8,1時間前,ポンコツ男,"いい加減陽性率発表しないのかな？
検査数が少なくて感染者公表が減るのはわかるけど
平日と休日で陽性者率に差があるのかは
しっかり公表した方がいいと思う。
国民の危機感を煽るわけじゃないけど
その方が感染拡大防止はもちろん
人に移す前にまず自分がかからないように
意識を強くさせることが出来ると思う。"
599,60-9,1時間前,tau*****,恵比寿のイルミネーションめっちゃ綺麗だったよ(^^)/
600,60-10,1時間前,bdn*****,"海外では変異型のコロナ流行ってますね

日本に来るのも時間の問題の気がします"
601,61-1,1時間前,djh*****,ロックダウンしないと人の流れなんて止めることなんかできないよ。
602,61-2,1時間前,m*****,重症者減ってきた。ピーク過ぎたな。
603,61-3,1時間前,ryo*****,"しっかし、これいつまで続けるつもりだ？
新型コロナの致死率は0.014％だぞ？
日本ではかかっても死なないと言ってもいいレベル。
5類相当から早くインフル並みの2類まで引き下げないと、それこそ
看護師や医者が死ぬわ。"
604,61-4,1時間前,idy*****,明日は驚きの数字かな。
605,61-5,1時間前,kiy*****,まだ増えそう。クリスマスや年末人が減るといいんだけどねぇ不要不急以外マスクもしないで外出し、その結果感染しても、それは自分が悪い訳で、家族感染も怖い。やはり自宅でもマスクは必要かも知れませんねぇクリスマスや年末の出歩きはしない方がいい、一度感染してもまたあ感染する見たいだし。
606,61-6,1時間前,yoh*****,"感染者数に重症者数を加えて発表することが当たり前になったのは良いことだが、同時に同日の死亡者数も発表しなければ現実が伝わりにくい。
3人重症者が増えて、5人亡くなっていれば単純に重症者数は2人減ったことになる。重症者ベッドの稼働率は実際に使用できるベッド数の定義によって変化するため、調べればわかることだが、毎日何人の人が亡くなっているかを加えて同時に発表してほしい。
同じ人50人を診るのとそのうちの5人が新たに重症化したのとでは、現場の負担は大きく異なる。"
607,61-7,1時間前,blu*****,昨今の夜のはっちゃけ方からすれば、当たり前の感染者数だね。後先考えずはっちゃけたんだから驚かない。そのツケを医療従事者に回したり年末年始の規制にしたのだからね。日本人の民度もその程度だと思う様になったよ。それと政府の入国緩和は大問題ですよ。完全にビジネスだけに限定しておけば良いのに、赤羽馬鹿国土交通大臣、政府から受入れが話されたからって、ハイハイと今日から札幌で旅客受入れ開始？国民を何人殺す気か？インフルエンザ以上に死亡者を出すまでやるのか？頭おかしいんじゃない。それならまだGo!To!の方がましだ！
608,61-8,1時間前,mti*****,"もういいよ、外出したい人も忘年会したい人もどうぞご勝手に。

その代わり、感染拡大抑止に協力した人とそうでない人にキチンと結果責任を負わせる仕組みづくりを法律で決めて実行しよう。受益者負担。ロックダウンのような人権無視の強制ではなく、フェアに協力者に利益を還元する仕組み。

具体的には、このままでは医療崩壊し、確実に患者選別トリアージ必至になるわけだから、ここに利益還元を行う。協力した人から万が一の時の医療を優先的に受けられるようにする。会食しまくって感染したり家族にうつしてしまったら連帯責任。保険者世帯丸ごと受療優先順位を下げる。逆にステイホームしたりリモートワークして移動しなかった人達の優先順位を上げる。

誰も使わないしほとんど感染予防に役に立ってないココアはやめて、本人の移動行動履歴をしっかり保存して、いざという時、優先順位を判定するアプリを作ればいい。

自分で作ろうかな。"
609,61-9,1時間前,koc*****,"いい加減に、東京都（神奈川県、埼玉県、千葉県もそうだけど）はすでにもう終わってるので
さっさとロックダウンして都への人の出入りをいっさい禁止にすること！
来年の１月又は2月いっぱいまでは都民、都在住者をいっさい都から一歩も出さないよう、絶対一歩も出ないようにすること！
また他県からの人の行き来往来を一切禁止してください！
余計なことは何もしなくていいのでこれだけすぐにやって頂きたい。
この先も東京都がどうなろうが知ったことじゃないけど周囲に迷惑をかけるようなマネは絶対しないで頂きたい。
人として常識のある行動をとってもらいたい。
ホントこれだけでいいからお願いしますよ！"
610,61-10,1時間前,gim*****,"平均600人の新規感染者に対して現時点の重症患者が63人。
1週間で4200人が新規に陽性反応が出ているのにトータルの重症患者は60人台をキープしている。
新規陽性反応者が増えても重症患者は一定。
つまりほとんどは重症化しない。
無症状軽症者をホテルに移動させれば医療崩壊なんてしないでしょう。"
611,62-1,1時間前,big*****,東京の感染者数とか何曜日最多とかよりも全国レベルの報道をするべき
612,62-2,1時間前,nya*****,過去最多とかもう飽きた。
613,62-3,1時間前,yar*****,オリンピックを開催する気満々の政府。やりたいんだったら今のうちから対策練ればいいのに。目の前のことしか見えない政府（目の前のことさえ見えないのかもしれないが）が来年夏のことを考える余裕はなさそう。
614,62-4,1時間前,tsu*****,"何曜日で過去最多って求めてない。
海外の入国規制や何かしらの打開策は無いのでしょうか？"
615,62-5,1時間前,lov*****,"もはや、感染列島である。
政府、小池さん、自民党､全て、
◎責任の取れる者は誰一人、居ない。
かつての戦時中より、更に誰も責任は取らない。
◎一部のお金持ちがなんとか生き延びて
貧乏人だけが苦しむなんて、酷すぎる。
来年は、景気は益々悪化し、倒産、失業者､自殺者が多くなるだろうか。
よく暴動が起きないのが何より不思議なくらいだ。"
616,62-6,1時間前,rur*****,言葉だけでは年末の外出をしないように言ってもだめだろう。1年中言われ続けているのだから、もっと強い指示を出さなければ。政府をあてにしてもどうしようもない。能力も意志がない。ニューヨーク市長など独自に判断している。例えば北海道・大阪のように自衛隊に応援を頼むとかすれば目に見えるので効果があるのではないか。自衛隊には申し訳ないが。あと以前のように買い物は一人でと言えば少しは外出が減るのではないか。
617,62-7,1時間前,ntc*****,"感染者が増加しているが、重症者は、増加
していない。不思議だ・。"
618,62-8,1時間前,そのタケコプターぼくのだぞ,"この政府のやってることは狂気の沙汰だ。一切信用出来ない。
しかし文句言ってもすぐ直るわけじゃないし、自衛するしかない。
ひたすらステイホーム。ぜったい出歩かない。まだ死にたくない。
次の選挙ではこのことを忘れない。

この党は利権ばかり優先して、国民の命を守ってくれない。"
619,62-9,1時間前,fuFufuFufuFu,"『月曜日では過去最多』ｗ
数の多さを強調するための努力乙ですｗｗ"
620,62-10,1時間前,大統領府政策企画局次長,"感染者数なんかどうでもいい
重症者数が増えたかどうかだけ発表しろ
メディアはおどろおどろしく感染者数ばかり発表して恐怖を煽りたいだけ"
621,63-1,1時間前,ths*****,"プロパガンダにまんまと騙されるバカが沢山いてびっくりした。
自分で考えられないのかな?
感情論抜きにして数字だけで判断すれば、普通の風邪と変わらないんじゃない"
622,63-2,1時間前,yns*****,"トップが忘年会やってれば、若者だってやるよ。
幾ら政治家が自粛を求めても無理だ。
そもそもTVも新聞も見ない多くの若者は今の現実は蜃気楼。
夏場に罰則規定を含んだ法律を決定していれば、もう少し違った。
一部野党の私権の制限はゆるされないとか阿保な議員は反省して欲しい。
こうなったらのは、自民党は勿論、野党の責任も大きい。"
623,63-3,1時間前,hir*****,帰省して食事はダメだろうな。
624,63-4,1時間前,qcs*****,もう少し早く増え始めた所でやれば年末年始の自粛をしなくてもよかったのではないか？？対応が遅い。一番の経済が動く時に自粛とは、最悪の決断、二階幹事長のせいでgotoを引き延ばしたお陰で最悪の結末、不公平なgotoキャンペーン愚策利権絡みの政策、経済も更に悪化大失敗。
625,63-5,1時間前,tap*****,少し前 テレビのインタビューで東京の若い女性は コロナについて聞かれた時 ああコロナ 私たち関係無いと答えていたよ こんなだから 東京はいつまで経ってもコロナば無くならないよ 何とかせよ
626,63-6,1時間前,mhq*****,ここまで感染拡大が深刻な状態で、なおかつ自ら密集して感染拡大に貢献されている、お馬鹿な国民の方々へ。もう病院にはあなた方が重症になっても受け入れできる病床はありません。もし体調不良になっても決して救急車など呼ばず、病院にもあしを運ばないでください。重篤になっても最後まで自宅でおとなしくしていてください。医療崩壊状態で、こんな無責任な方々への医療提供の余裕は全くありません。そのことをよく理解し、決して医療現場に迷惑をかけない覚悟を持って下さいね。
627,63-7,1時間前,hi-ragi,"入国規制もしないでよく勝負の3週間など言えたものだ。言わせてもらえば勝負の土俵にすら上がっていないのに、声だけ張り上げてる頭のおかしい観客のそれに近い発言だったと思う。

日本人に自粛せよ、協力を。とかいうくせに国が何もしないんならもういいです。無視します。時短営業とかやらない店も増えるでしょう。それくらい馬鹿馬鹿しい。GoTo止めただけで一仕事やった気になってるのは実に滑稽だ。"
628,63-8,1時間前,slo*****,もう印象的に○○人感染って情報は垂れ流されてるようにしか思えない。
629,63-9,1時間前,ashshtoashsh,"感染力高まった変異株もどんどん入ってくるよお。ガースー危機感なしでまいるね。
国民のことを考えてない。だますばっかり。
特に財務省は諸悪の根源。"
630,63-10,1時間前,ham*****,"数字をよく見て一人一人冷静な判断ができる人間になろうね！
ワイドショーだけをみてオロオロするような人間にだけは決っしてなってはいけない。
ヤフコメで大騒ぎしている方々は大丈夫かな？"
631,64-1,1時間前,umd*****,コロナより選挙。選挙前に菅は降ろされるな。
632,64-2,1時間前,rup*****,"何%で、ほとんど持病持ちだろ？
やめろ！！
経済ダメにしてどうする！"
633,64-3,1時間前,npx*****,"東京にいると別に危機感は全くない。
マスクしておけばいい。
マスクも周りの目が一番の理由かも。"
634,64-4,1時間前,fylgっzbjhrdsxb,"変異種が海外で確認されてるのに入国緩和はまた制限掛けないと　安部政権では後手後手に回ってた。

菅政権も感染拡大を招いてしまったしっかりしろ日本
小池知事みたいに具体的に　自分の口で発言してください。"
635,64-5,1時間前,fvd*****,"感染者の増産と
感染者の輸入！

これが日本政府がやってる事です"
636,64-6,1時間前,hak*****,GOTO関係ないよ。東京は減らない。マスコミは世論とか言ってたけど無駄な税金使わせて謝罪でもしたほうがいいんじゃない？
637,64-7,1時間前,パヨール石丼,日刊ゲンダイ読んでるようなコメントの数々
638,64-8,1時間前,may*****,"街にはコロナ慣れしたたくさんの人が出ています。

彼らにほぼ共通していることが１つだけあって、それは自分に陽性経験もしくは濃厚接触者経験がないということ。


つまりは他人事なんですよね。

陽性になれば症状の不安、家族、仕事、準備、環境、社会的差別…と考えることが山のように出てくる。

濃厚接触者になれば陰性と出ても2週間の外出禁止となるので生活への影響は大きい。

それを実際に体験しないと分からないんでしょうね。


今後日本では1日4桁が普通になり都内だけでも1000人、2000人という日が来ます。
今出歩いている人もいずれ体験できるでしょう。
その時にぜひ体験してみて下さい！！"
